{
  "$schema": "https://json-schema.org/draft/2020-12/schema",
  "$id": "https://antigravity.local/contract/report.schema.json",
  "title": "Antigravity engine output (report.json)",
  "type": "object",
  "required": ["schema_version", "run_id", "generated_at", "engine_version", "baseline_version",
               "overall", "summary", "categories", "fixes", "top_fixes", "scan"],
  "properties": {
    "schema_version":   { "type": "string", "pattern": "^1\\.\\d+\\.\\d+$" },
    "run_id":           { "type": "string", "pattern": "^\\d{4}-\\d{2}-\\d{2}T\\d{2}-\\d{2}-\\d{2}Z_[0-9a-f]{4}$" },
    "generated_at":     { "type": "string", "pattern": "^\\d{4}-\\d{2}-\\d{2}T\\d{2}:\\d{2}:\\d{2}Z$" },
    "engine_version":   { "type": "string" },
    "baseline_version": { "type": "string" },
    "overall":          { "$ref": "#/$defs/rag" },
    "summary":          { "type": "string", "minLength": 1, "maxLength": 200 },

    "categories": {
      "type": "array",
      "minItems": 5, "maxItems": 5,
      "prefixItems": [
        { "$ref": "#/$defs/category", "properties": { "id": { "const": "backup" } } },
        { "$ref": "#/$defs/category", "properties": { "id": { "const": "patch" } } },
        { "$ref": "#/$defs/category", "properties": { "id": { "const": "software" } } },
        { "$ref": "#/$defs/category", "properties": { "id": { "const": "protection" } } },
        { "$ref": "#/$defs/category", "properties": { "id": { "const": "recovery" } } }
      ],
      "items": false
    },

    "fixes": {
      "type": "array",
      "items": {
        "type": "object",
        "required": ["id", "category", "severity", "title", "why", "steps", "effort_minutes", "needs_admin"],
        "properties": {
          "id":             { "$ref": "#/$defs/fixId" },
          "category":       { "$ref": "#/$defs/categoryId" },
          "severity":       { "enum": ["red", "amber"] },
          "title":          { "type": "string", "maxLength": 80 },
          "why":            { "type": "string", "maxLength": 160 },
          "steps":          { "type": "array", "minItems": 1, "maxItems": 5, "items": { "type": "string", "maxLength": 160 } },
          "effort_minutes": { "type": "integer", "minimum": 1 },
          "needs_admin":    { "type": "boolean" }
        }
      }
    },

    "top_fixes": { "type": "array", "maxItems": 3, "uniqueItems": true, "items": { "$ref": "#/$defs/fixId" } },

    "scan": {
      "type": "object",
      "required": ["is_admin", "duration_ms", "os_caption"],
      "properties": {
        "is_admin":    { "type": "boolean" },
        "duration_ms": { "type": "integer", "minimum": 0 },
        "os_caption":  { "type": "string" }
      }
    }
  },

  "$defs": {
    "rag":        { "enum": ["red", "amber", "green"] },
    "status":     { "enum": ["red", "amber", "green", "unavailable", "failed"] },
    "categoryId": { "enum": ["backup", "patch", "software", "protection", "recovery"] },
    "fixId":      { "type": "string", "pattern": "^[a-z0-9]+(-[a-z0-9]+)*$" },
    "category": {
      "type": "object",
      "required": ["id", "title", "status", "explanation", "evidence", "fix_ids"],
      "properties": {
        "id":          { "$ref": "#/$defs/categoryId" },
        "title":       { "type": "string" },
        "status":      { "$ref": "#/$defs/status" },
        "explanation": { "type": "string", "minLength": 1, "maxLength": 200 },
        "evidence": {
          "type": "array", "maxItems": 8,
          "items": {
            "type": "object", "required": ["label", "value"],
            "properties": {
              "label":  { "type": "string" },
              "value":  { "type": "string" },
              "status": { "$ref": "#/$defs/status" }
            }
          }
        },
        "fix_ids": { "type": "array", "items": { "$ref": "#/$defs/fixId" } }
      }
    }
  }
}
